symbol,position,rationale,disclosureDate,transactionDate,firstName,lastName,office,owner,assetDescription,assetType,type,amount,link,chamber
AMD,long,"Recent inflow signals positive investor sentiment, bolstered by strong market demand for semiconductors.",2025-03-23,2025-02-24,Ashley,Moody,Ashley Moody,Self,Advanced Micro Devices Inc,Stock,Purchase,175000.5,https://efdsearch.senate.gov/search/view/ptr/376521e5-ad5e-44ec-8bd4-63847da2e049/,senate
BITB,long,Strong net flow indicates bullish sentiment and potential for continued upward momentum.,2025-03-30,2025-02-27,Dave,McCormick,Dave McCormick,Self,BITWISE BITCOIN ETF,ETF,Purchase,1182511.0,https://efdsearch.senate.gov/search/view/ptr/5823084a-1dd6-4707-aee5-53c57af4df8c/,senate
COF,short,"Stagnant net flow suggests potential challenges in the lending space, warranting a cautious approach.",2025-04-12,2025-03-19,Markwayne,Mullin,Markwayne Mullin,Joint,Capital One Financial Corp,Stock,Purchase,32500.5,https://efdsearch.senate.gov/search/view/ptr/7202646a-173e-4d52-ae17-80536038a476/,senate
KHC,short,Weak net flow may indicate declining investor confidence in the food industry amid rising competition.,2025-04-18,2025-03-04,Michael,McCaul,Michael McCaul,Spouse,The Kraft Heinz Co,Stock,Purchase,75000.5,https://disclosures-clerk.house.gov/public_disc/ptr-pdfs/2025/8220834.pdf,house
LLY,long,Significant net flow suggests confidence in pharmaceutical products and ongoing strong performance.,2025-03-23,2025-03-06,Ashley,Moody,Ashley Moody,Self,Eli Lilly and Co,Stock,Purchase,175000.5,https://efdsearch.senate.gov/search/view/ptr/376521e5-ad5e-44ec-8bd4-63847da2e049/,senate
MSFT,long,"Consistent net inflow reinforces strong market position in cloud services, AI, and software solutions.",2025-03-05,2025-02-14,John,Boozman,John Boozman,Joint,Microsoft Corp,Stock,Purchase,64502.5,https://efdsearch.senate.gov/search/view/ptr/6cf4a78e-92f0-4201-bf73-e9b02cd8f9ef/,senate
NFLX,long,Recent growth and investor interest may indicate a recovery after content expansion and user base growth.,2025-04-18,2025-03-13,Michael,McCaul,Michael McCaul,Spouse,Netflix Inc,Stock,Purchase,48501.5,https://disclosures-clerk.house.gov/public_disc/ptr-pdfs/2025/8220834.pdf,house
NVDA,long,"Solid net inflow reflects enthusiasm around AI and gaming sectors, along with positive earnings outlook.",2025-04-20,2025-03-25,Ashley,Moody,Ashley Moody,Self,NVIDIA Corporation,Stock Option,Sale,231502.5,https://efdsearch.senate.gov/search/view/ptr/19100e4c-0acb-45fb-9eb3-34ec9460d5e9/,senate
VMC,short,"Consistent but low net flow may indicate struggles within the construction sector, making it a candidate for shorting.",2025-04-18,2025-03-21,Michael,McCaul,Michael McCaul,Spouse,Vulcan Materials Co,Stock,Purchase,32500.5,https://disclosures-clerk.house.gov/public_disc/ptr-pdfs/2025/8220834.pdf,house
