symbol,position,rationale,disclosureDate,transactionDate,firstName,lastName,office,owner,assetDescription,assetType,type,amount,link,chamber
BITB,long,"Strong net inflow indicates bullish sentiment, suggesting potential for price appreciation.",2025-03-30,2025-03-20,Dave,McCormick,Dave McCormick,Self,BITWISE BITCOIN ETF,ETF,Purchase,1182511.0,https://efdsearch.senate.gov/search/view/ptr/5823084a-1dd6-4707-aee5-53c57af4df8c/,senate
CACI,long,"Consistent net inflow reflects confidence in its defense and intelligence services, which may benefit from government contracts.",2025-04-18,2025-03-06,Michael,McCaul,Michael McCaul,Spouse,CACI International Inc,Stock,Purchase,175000.5,https://disclosures-clerk.house.gov/public_disc/ptr-pdfs/2025/8220834.pdf,house
COF,short,"Recent underperformance in the financial sector raises concerns, despite slight positive net flow.",2025-04-12,2025-03-19,Markwayne,Mullin,Markwayne Mullin,Joint,Capital One Financial Corp,Stock,Purchase,32500.5,https://efdsearch.senate.gov/search/view/ptr/7202646a-173e-4d52-ae17-80536038a476/,senate
GIS,short,"Current market trends favor healthier, fresher foods over processed options, indicating potential challenges ahead.",2025-03-30,2025-03-13,Dave,McCormick,Dave McCormick,Self,General Mills Inc,Corporate Bond,Purchase,725001.5,https://efdsearch.senate.gov/search/view/ptr/5823084a-1dd6-4707-aee5-53c57af4df8c/,senate
KBH,long,Recent positive performance and significant congressional flow suggest momentum in the homebuilding sector.,2025-03-30,2025-03-05,Dave,McCormick,Dave McCormick,Self,KB Home,Corporate Bond,Purchase,375000.5,https://efdsearch.senate.gov/search/view/ptr/5823084a-1dd6-4707-aee5-53c57af4df8c/,senate
LEN,short,"While there is some inflow, market conditions in the housing sector remain uncertain, suggesting potential downside.",2025-04-18,2025-03-25,Michael,McCaul,Michael McCaul,Spouse,Lennar Corp,Stock,Purchase,107501.0,https://disclosures-clerk.house.gov/public_disc/ptr-pdfs/2025/8220834.pdf,house
MSFT,long,"Continued strong performance in cloud services and AI, coupled with net inflow, suggests growth potential.",2025-03-05,2025-02-05,John,Boozman,John Boozman,Joint,Microsoft Corp,Stock,Purchase,64502.5,https://efdsearch.senate.gov/search/view/ptr/6cf4a78e-92f0-4201-bf73-e9b02cd8f9ef/,senate
NVDA,long,"Ongoing demand for GPUs in AI and gaming, combined with positive net flow, indicates strong upside potential.",2025-04-20,2025-03-20,Ashley,Moody,Ashley Moody,Self,NVIDIA Corporation,Stock,Purchase,231502.5,https://efdsearch.senate.gov/search/view/ptr/19100e4c-0acb-45fb-9eb3-34ec9460d5e9/,senate
UNH,long,Positive net flow and stability in healthcare sector position it well for growth despite market fluctuations.,2025-04-18,2025-03-13,Michael,McCaul,Michael McCaul,Spouse,Unitedhealth Group Inc,Stock,Purchase,32500.5,https://disclosures-clerk.house.gov/public_disc/ptr-pdfs/2025/8220834.pdf,house
